{
  "schemaVersion": "0.2.0",
  "snapshot": "research-mobile-llm-2026-09-17",
  "generatedAt": "2026-09-16T20:20:04.000Z",
  "toolchains": {
    "ios": {
      "name": "Xcode/devicectl",
      "available": true,
      "version": "Xcode 26.4.1\nBuild version 17E202",
      "command": "xcodebuild -version; xcrun devicectl list devices"
    },
    "android": {
      "name": "Android SDK/adb",
      "available": false,
      "version": "unavailable",
      "command": "adb --version; adb devices -l"
    }
  },
  "results": [
    {
      "schemaVersion": "0.2.0",
      "runId": "preflight-2026-09-17-research-ios-01e764fa",
      "modelId": "Qwen/Qwen3-0.6B",
      "modelRevision": "a9c98e602b9d36d2a2f7ba1eb0f5f31e4e8e5143",
      "platform": "ios",
      "runtime": "core-ai",
      "status": "blocked",
      "toolchain": {
        "name": "Xcode/devicectl",
        "available": false,
        "version": "Xcode 26.4.1\nBuild version 17E202"
      },
      "checkedAt": "2026-09-16T20:20:04.000Z",
      "reason": "Research preflight blocked: Apple Core AI requires Xcode/iOS 27, but Xcode 26.4.1 Build version 17E202 was observed; No physical iPhone was listed by devicectl; no device evidence was fabricated.",
      "command": "xcrun devicectl list devices",
      "logPath": null,
      "logChecksum": null,
      "capabilities": [
        "text-generation",
        "source-evidence-verified"
      ]
    },
    {
      "schemaVersion": "0.2.0",
      "runId": "preflight-2026-09-17-research-android-01e764fa",
      "modelId": "Qwen/Qwen3-0.6B",
      "modelRevision": "a9c98e602b9d36d2a2f7ba1eb0f5f31e4e8e5143",
      "platform": "android",
      "runtime": "executorch",
      "status": "blocked",
      "toolchain": {
        "name": "Android SDK/adb",
        "available": false,
        "version": "unavailable"
      },
      "checkedAt": "2026-09-16T20:20:04.000Z",
      "reason": "Research preflight blocked: Android SDK/adb and a physical device are unavailable; ADB is unavailable or no Android device is connected; no device evidence was fabricated.",
      "command": "adb devices -l",
      "logPath": null,
      "logChecksum": null,
      "capabilities": [
        "text-generation",
        "source-evidence-verified"
      ]
    },
    {
      "schemaVersion": "0.2.0",
      "runId": "preflight-2026-09-17-research-ios-29a8e11e",
      "modelId": "Qwen/Qwen3-1.7B",
      "modelRevision": "70d244cc86ccca08cf5af4e1e306ecf908b1ad5e",
      "platform": "ios",
      "runtime": "core-ai",
      "status": "blocked",
      "toolchain": {
        "name": "Xcode/devicectl",
        "available": false,
        "version": "Xcode 26.4.1\nBuild version 17E202"
      },
      "checkedAt": "2026-09-16T20:20:04.000Z",
      "reason": "Research preflight blocked: Apple Core AI requires Xcode/iOS 27, but Xcode 26.4.1 Build version 17E202 was observed; No physical iPhone was listed by devicectl; no device evidence was fabricated.",
      "command": "xcrun devicectl list devices",
      "logPath": null,
      "logChecksum": null,
      "capabilities": [
        "text-generation",
        "source-evidence-verified"
      ]
    },
    {
      "schemaVersion": "0.2.0",
      "runId": "preflight-2026-09-17-research-android-29a8e11e",
      "modelId": "Qwen/Qwen3-1.7B",
      "modelRevision": "70d244cc86ccca08cf5af4e1e306ecf908b1ad5e",
      "platform": "android",
      "runtime": "executorch",
      "status": "blocked",
      "toolchain": {
        "name": "Android SDK/adb",
        "available": false,
        "version": "unavailable"
      },
      "checkedAt": "2026-09-16T20:20:04.000Z",
      "reason": "Research preflight blocked: Android SDK/adb and a physical device are unavailable; ADB is unavailable or no Android device is connected; no device evidence was fabricated.",
      "command": "adb devices -l",
      "logPath": null,
      "logChecksum": null,
      "capabilities": [
        "text-generation",
        "source-evidence-verified"
      ]
    },
    {
      "schemaVersion": "0.2.0",
      "runId": "preflight-2026-09-17-research-ios-f443c628",
      "modelId": "Qwen/Qwen3-4B",
      "modelRevision": "1cfa9a7",
      "platform": "ios",
      "runtime": "core-ai",
      "status": "blocked",
      "toolchain": {
        "name": "Xcode/devicectl",
        "available": false,
        "version": "Xcode 26.4.1\nBuild version 17E202"
      },
      "checkedAt": "2026-09-16T20:20:04.000Z",
      "reason": "Research preflight blocked: Apple Core AI requires Xcode/iOS 27, but Xcode 26.4.1 Build version 17E202 was observed; No physical iPhone was listed by devicectl; no device evidence was fabricated.",
      "command": "xcrun devicectl list devices",
      "logPath": null,
      "logChecksum": null,
      "capabilities": [
        "text-generation",
        "source-evidence-verified"
      ]
    },
    {
      "schemaVersion": "0.2.0",
      "runId": "preflight-2026-09-17-research-android-f443c628",
      "modelId": "Qwen/Qwen3-4B",
      "modelRevision": "1cfa9a7",
      "platform": "android",
      "runtime": "executorch",
      "status": "blocked",
      "toolchain": {
        "name": "Android SDK/adb",
        "available": false,
        "version": "unavailable"
      },
      "checkedAt": "2026-09-16T20:20:04.000Z",
      "reason": "Research preflight blocked: Android SDK/adb and a physical device are unavailable; ADB is unavailable or no Android device is connected; no device evidence was fabricated.",
      "command": "adb devices -l",
      "logPath": null,
      "logChecksum": null,
      "capabilities": [
        "text-generation",
        "source-evidence-verified"
      ]
    }
  ],
  "intersection": {
    "status": "verified-empty",
    "candidateIds": [],
    "reason": "No source-verified candidate passed executable preflight on this host; all six rows are blocked by known toolchain/device prerequisites."
  }
}
